text,emotion
It's a decent flick. Id watch it,happiness
OK . Please step in . I know where it is .,happiness
Just fine . I tried to answer every question raised by HR carefully . I found some answering skills are useful . These questions are different from exams .,no_emotion
Good . That ’ s something unusual .,happiness
"Really ? Well , I guess I have to get used to it .",surprise
Thank you 👍,happiness
Lol. That's exactly what I said. Yep. That's it.,happiness
"Yes , I think my vocabulary and reading comprehension are not very bad .",no_emotion
"It ’ ll be mailed to you within two weeks , but you can borrow books on the temporary card .",no_emotion
"No , I didn't . And you ? Was it good ?",no_emotion
That ’ s fine ! Don ’ t worry about it !,happiness
"Mike , come and look at this painting of shrimp ! It is so simple yet so vivid !",happiness
"Some customers demand that 80 % of the credit amount be paid at sight , and the rest be paid after the machines are proved satisfactory on trial .",no_emotion
"On the fourth day , we went to taste the French cuisine . That was really fantastic . And no stomach problems .",happiness
"i don't think we really need to sign anybody to replace [NAME] assuming that pulls through, we can go small ball with [NAME] at the 4 or [NAME]",sadness
"Not necessarily . It depends on the contract stipulations . They may be marketed in the foreign country where the other party is located , or even in a third country .",no_emotion
"Ah , ah , you promised , and remember ?",no_emotion
"My mother used to make me take vitamins every day , but I don't take them anymore . Vitamins are good as a supplement , but they don't do much good if you don't have a well-balanced diet to start .",no_emotion
All right . See you tomorrow .,no_emotion
"You’re allllll alone [NAME], lmfao.",no_emotion
this is probably one of the top 5 most legendary copypastas from this community - I’ve always loved this one,happiness
That restaurant has six parking spaces .,no_emotion
It's a black leather one.There are my credit card and ID and some money .,no_emotion
Could you teach me how to drive ?,no_emotion
He borrowed it from Nick .,no_emotion
I think that we have a pretty good idea of what we would like to order .,happiness
I see .,no_emotion
How do you want your hair cut ?,no_emotion
"I'm trying to turn it on , but it won't work .",no_emotion
That would be lovely . But now let's go and get a drink .,happiness
So now do you want a full-time job or part-time job ?,no_emotion
To be honest he doesn't have to be sorry for smoking weed. Your neighbor is a yuppy.,no_emotion
Maybe it ’ s just a rash or an allergy ! We can ’ t be sure until I see a doctor .,no_emotion
"Get a hold of yourself , Bruce . You'll get over her eventually .",no_emotion
They need to be there at eleven in the morning .,no_emotion
There are a couple of reasons why you didn't pass .,no_emotion
That's all I have to do ?,no_emotion
I ’ m happy that you find this apartment so appealing .,happiness
"Ok , here ’ s a list of chores we need to get done . I'll do the dishes and get all the groceries for tonight . You can sweep and mop the floors . Oh , and the furniture needs to be dusted .",no_emotion
"Yeah , you ’ re quite right and what ’ s your hobby ?",no_emotion
( Later .. ) Everything looks tempting . What do you want to have ?,no_emotion
I would love to accidentally get muscular... Instead of working my arse off to lose fat at the moment.,happiness
Why ask other than to be rude?,no_emotion
Or they drop out cause they have no interest in learning the language (a lot of kids do this unfortunately),sadness
"Well , I talk to myself . That is , I play one role first , than the other .",no_emotion
I like a person who works hard . I don ’ t like lazy people .,no_emotion
"Mr . Jackson , I've drafted a schedule for your business trip next week . You may have a look .",no_emotion
Don ’ t tell me what to do ! I ’ ll get to it when I get around to it !,anger
Did you know hat your actions might cause serous injuries or death ?,no_emotion
Now we get along very well . It makes me feel that I'm someone special .,happiness
Statute of limitations was up by the time I had a backbone,no_emotion
Would you be able to pick him out of a line-up ?,no_emotion
Most Sichuan dishes are spicy and hot . They taste differently .,no_emotion
Abortion. emails. BENGHAZI! red cups Happy Holidays,happiness
"2 nights , how much does it cost ?",no_emotion
So he had the boxes wrapped in plastic .,no_emotion
I did some social media snooping since I posted this. Turns out they’re both not retired at 25. Go figure.,anger
I both loathe and applaud you,happiness
"The 4th line for Philly is trash, an all rookie line could probably handle them",no_emotion
Where did this come from ?,no_emotion
"Basically , I ’ Ve got a few concerns about him , and the bottom line is , I don ’ t think he ’ s a good fit for our company .",no_emotion
From one to two .,no_emotion
How would your present boss describe you ?,no_emotion
Can you tell me where it hurts ?,no_emotion
I hope I still have chances .,happiness
#I DID NOT HAVE SEXUAL RELATIONS WITH THAT WOMAN.,no_emotion
"Are you feeling better today , Bill ?",no_emotion
"I wish I could place a monthly order for a minimum of 50 cases , introducing your goods to my customers , but your price , $ 100 for a case , is too high in this highly competitive market .",no_emotion
It is . But buying a house is very important . So it takes time . That's why we haven't done it yet . It's very troublesome .,no_emotion
Yay!!! Finally the fix we're all looking for after hours of endless scrolling.,happiness
What was I expecting smh,no_emotion
Sure .,no_emotion
It will be released next month .,no_emotion
"Many children are learning drawing , dancing , swimming and so on in their spare time . You can follow suit .",no_emotion
Great info. Thx,happiness
"The functional use could be served by a $5 watch, so that's not really the point.",no_emotion
I want to transfer $ 200 .,no_emotion
You two are always quarrelling over little things .,no_emotion
Let the men take the lead !,no_emotion
What does the job description say ?,no_emotion
"Sure . We attach great importance to the all-round development of the staff , and the development of individuals will motivate them to work more diligently and efficiently .",no_emotion
Alright . See ya !,no_emotion
Maybe we should just wait for the next bus .,no_emotion
"No , the one next to it .",no_emotion
"Have you got a sore throat , too ?",no_emotion
"Which of the steps are you focusing on in brandgrowth Awareness , understanding , acceptance , or loyalty ?",no_emotion
I hear that you've got a chance to go to Europe for a half-year training program . Is it true ?,no_emotion
Not really cringe. Just sad.,sadness
It was 90 degrees,no_emotion
If you buy me a ticket I will go with you for sure !,no_emotion
Yes .,no_emotion
My life!,no_emotion
I don't know . I never went to one .,no_emotion
really ? tell me about it . I haven't gone to the club for a long time . I am too busy with work .,no_emotion
"I have , but I have never done this before so would it be possible for you to double check them ?",no_emotion
Guy looks like he's taking a nasty deuce.,anger
"Spread some jam , please .",no_emotion
Ehhh he got played so hard on the [NAME] vs [NAME] situation in 2017. Lost credibility after that for me,sadness
"Here's your money , your card and your passport . Please double check the amount for me .",no_emotion
"If you take an antihistamine , that would help a lot .",no_emotion
I like reading novels about early America .,no_emotion
it sounds like you just need to be more careful .,no_emotion
I think neither your parents or mine would agree to such an idea .,no_emotion
Dalian is my hometown .,no_emotion
I'm sure you'll pass it .,no_emotion
"Sadly, it ran. :( I hope you're enjoying your trip overseas! :D",sadness
There's no particular place that you want to look at ?,no_emotion
Less than 75 years ago my grandparents had swastikas burned on their front lawn in South Carolina after fleeing from Germany.,no_emotion
it ’ s about six or seven miles . That ’ s about the kilometers .,no_emotion
"What, so you want me to just trade in my car for a Jetta just because you flunked out of every private school I ever sent you to?",no_emotion
"He kept trying to make stupid excuses , and then broke down and admitted to a small indiscretion .",no_emotion
OK .,no_emotion
"Would not put too much trust on the numbers, Canadian journalists did a test on couple of these services and got different results between two identical twins.",sadness
What exactly does that mean ?,no_emotion
I'll call you later .,no_emotion
"In order to extend our export business to your country , we wish to enter into direct business relations with you .",happiness
"I'm sorry , Ms.Jenkins is away from her desk.She has already left for lunch.Would you like to leave a message for her ?",no_emotion
"Can you tell me the way to the Peak Tram , please ?",no_emotion
Protestantism never cease to amaze me with its joke of theology and non existent historical justification.,no_emotion
You're telling me ! There are thousands of people here .,happiness
... Still laughed!,happiness
That'll be 60 dollars .,no_emotion
What kind of currency have you got ?,no_emotion
"Ok , I ’ ll take a return ticket on the soft sleeper please .",no_emotion
"It is very hard , you know .",no_emotion
Thank you for your praise .,happiness
"Hi , Kenji .",no_emotion
"By the way , I'm Robin .",no_emotion
I'll be happy to try .,no_emotion
That’s an early contender for title of the year 2019. Bravo.,happiness
"That ’ s not all ! I also had to finish writing a sales report for my boss . In the end , I finished everything . I wonder what will be waiting for me tomorrow morning .",disgust
"Ok , I'll get this rate right away .",no_emotion
"I said , ' Do you need any help ? '",no_emotion
"Let ’ s go over there and get some milk , a couple dozen eggs and some orange juice .",no_emotion
Of course . What would you like ?,no_emotion
What is it ?,no_emotion
An impressive officer is vital to the image projected by the company .,no_emotion
I think so . I set it by the radio this morning .,no_emotion
Yes.please .,no_emotion
Ballroom Blitz. Thank me later.,happiness
How do I do that ?,no_emotion
What do you have in mind ?,no_emotion
"Alright , sir . I will get the paperwork ready for you . Just a moment .",no_emotion
I guess I ’ ll just have to tell Mr . Robinson that you ’ re too busy every evening – doing God knows what ... God don ’ t go on like this . If you absolutely refuse to take her out ...,no_emotion
"Yes , I know what the curb colors mean .",no_emotion
"Well , do you have a menu in Chinese ?",no_emotion
"Good fun, just dont over do it, or you will get very bored fast.",no_emotion
You don ’ t have to eat them . I don ’ t mind .,no_emotion
Pretty good . There was a bit of turbulence while we were over the Pacific Ocean but it wasn't too bad . The worst thing was the guy behind me . He snored all through the night !,happiness
The nails are great,happiness
There ’ s a possibility .,no_emotion
Yeah.It ' s a must for me .,no_emotion
[NAME] damn cummonists,anger
I'll send a squad car .,no_emotion
Because we're partners .,no_emotion
Oh my. That will show them,no_emotion
What's he trying to pull anyway .,no_emotion
Winter isn't even that bad here.,no_emotion
"No , not the really , don't worry about it , like I said there'll be a lot of people there doing the same thing that you are doing , so just follow the crowd , There's only one direction to go , so you won't get on the wrong train . Head north on the Yellow line , and you'll see Wudaokou in just a couple of stops .",no_emotion
Margaret Mitchell .,no_emotion
You wouldn ’ t dare do that !,anger
Don't drive too fast .,no_emotion
"Just a minute , please .",no_emotion
Yes he ' s in his office .,no_emotion
"OK , I will send the information to you .",no_emotion
"Oh, no wonder I like her so much!",happiness
You cannot open or keep it. You can send it RTS.,no_emotion
"You mean he plays well ? Yeah , he often scores by free kicks in crucial games . But a football match is by no means merely a show of taking free kicks .",no_emotion
"I don't remember, it was all very hazy...",sadness
It's all in the bag .,no_emotion
"Yes , I ’ d like to book a single room with a bath from the afternoon of October 4th to the morning of October 10th .",no_emotion
Everyone’s so sensitive about Wigs. People can joke and support him at the same time,no_emotion
I have three years of teaching ESL and four years of teaching per-school children .,no_emotion
She and Vic broke up and now she ’ s asked for a transfer .,no_emotion
"I need at least 75,000 per year .",no_emotion
Are they liqueur chocolates ?,no_emotion
"Hey , slow down . I'll tell you more while playing .",no_emotion
That was very thoughtful of you to volunteer me .,no_emotion
It's so pleasant after the bad weather we've been having .,happiness
Thanks .,no_emotion
"Oh . Yes , I ’ m ready to transfer .",no_emotion
He mustn't know about Mr. [NAME] and the cause of his untimely death.,sadness
"I am not sure what to do during the holidays , any suggestions ?",no_emotion
Not always . It depends on the transmission of the satellite signals .,no_emotion
James is going to be packed off there .,no_emotion
No it’s true. However it is time to rethink how we recycle clothing in cities and the elimination of donation bins is step one.,sadness
Would you like a drink ?,no_emotion
You ’ re the best !,happiness
"How would you like to pay , Ms . Jones ?",no_emotion
> 1 in 4 women will be victims of sexual assault. 4 in 4 idiots will believe this without proof.,happiness
Translation }}} I wish I could afford it.,happiness
No worries.,no_emotion
That's because you are always fixing your eyes on the bald .,no_emotion
Then you go out to the garage and check out the camping gear .,no_emotion
Where's Bob ?,no_emotion
Did you hear who won the election ?,no_emotion
How many planets are there in the solar system ?,no_emotion
Anything else ?,no_emotion
My point is that you followed this subreddit to watch videos like this and then comment and say it shouldn't exist. Are you thick?,no_emotion
"[NAME]. Get off of the computer my man. Get some fresh air, there’s a whole world out there. ⛑",happiness
How has nobody in the coaching staff tried to stop [NAME] from going in and killing us,no_emotion
How disgusting. Those vile people can burn in hell!,disgust
What do you mean ?,no_emotion
How does this Friday sound ?,no_emotion
"That's possible . At that time , they can choose any activity they like .",no_emotion
That's helpful for your health .,no_emotion
lol this is nothin. I go on reddit to hear myself be right,happiness
Apologies but what movie is this from?,no_emotion
"Hi , charlie , are you busy this evening ?",no_emotion
"Here you go, sis. be warned tho, top cringe.",no_emotion
Yes ?,no_emotion
I think so . I bought some paper plates and cups for people to use . It will save on the washing up !,no_emotion
Thank you . Please keep this receipt .,no_emotion
Right at the Hilton .,no_emotion
He said his present job seemed to be a blind alley .,no_emotion
Absolutely . I ’ m a great mechanic .,no_emotion
What are the temperatures in winter ? in my city it is about 15 or 20 degrees .,no_emotion
"Holy [NAME], our hope and handmaid of the [NAME], pray for us!",happiness
THAT'S WHAT YOU GET WHEN YOU FIND A STRANGER IN THE ALPS,no_emotion
I have a B . A . in Economics .,no_emotion
"By the way , do I need a transfer again after No . 50 ?",no_emotion
"Exactly . Then each individual has the chance to diversify their portfolio over many different areas , it doesn't have to be stocks . And , we provide a Professional Fund Manager , so you know your investment will be safe with us .",no_emotion
349-95- 8821 .,no_emotion
"No she does not, not alone and not during sex(sadly) ",sadness
"OK , I will arrange it for you .",no_emotion
I hope that he brings change to America .,no_emotion
"Sometimes working with a foreign company can be stressful . Foreigners tend to get excited or angry easily , and they show it . Are you sure you can handle this stress ? How do you deal with conflict in your present job ?",no_emotion
"Yes , please tell her I stopped by .",no_emotion
Are these all of them ?,no_emotion
"No , who won ?",no_emotion
What will you have ?,no_emotion
"Left or right, doesn't matter, just laugh at statists on all sides ",happiness
"Yes , we've already prepared one . I've brought it with me . I'll put it forward when we talk with the manufacturers tomorrow .",no_emotion
They both just talk about how great they are all the time .,anger
That ’ s right .,no_emotion
Let's speed up . We're going to be late again .,no_emotion
"Yes . I am very interested in the Olympic Games , and I'm especially excited about 2008 Beijing Olympics .",no_emotion
Would you like to go to a concert tonight ?,happiness
I really like Caesar salads .,happiness
"If she is hot and has nice shoes...""I like your shoes."" ",happiness
I ’ m sorry to hear that . Is there anything else I can do ?,no_emotion
What do you think I should do ?,no_emotion
Remember what happened last time ?,no_emotion
Does it mean anything ?,no_emotion
"Count it yourself, you're more off than the original post. [NAME] shot her 9 times.",no_emotion
Give it to me .,no_emotion
"Once I saw who posted the video, I was certain I knew who it was, and I was right. Glad to see him back in action!",happiness
My experience in my last job showed that I have the talent to motivate people . It could be seen from the low absentee rate in my team . I want to continue that kind of contribution and to further develop this potential .,no_emotion
How do I use it ?,no_emotion
How do you spend your spare time ?,no_emotion
"Yeah . Two-toned , white and yellow .",happiness
"I get that , but let me just sleep for a little bit longer .",no_emotion
What finance experience have you had that qualifies you for this position ?,no_emotion
"Probably one everytime I run out of the $1 million, 97% success rate? Worth the risk ",happiness
"He came to work late every day that week . Then on Friday , he didn't show up at all .",no_emotion
Would be better if not for the stupid gas mask. Should have had it's own comissar cap instead!,no_emotion
Do you want the whole amount in traveler's check ?,no_emotion
Love futurama.,happiness
With the high turnover rate maybe it does lol!,happiness
"Well , what shampoo do you prefer ?",no_emotion
No that was my cyst that got removed today lol,happiness
"You forgot all of about it , didn't you ?",happiness
"She's cute but she's got that crazy look, the type of girl that would cut your d*ck off. 😬",happiness
"as is tradition, guy who played for us scores against us to make us lose, third time in three months",no_emotion
"Very well , I'll try the banana flavor .",no_emotion
"Think of the big face down the eve , hmm .",no_emotion
"All of your friends , what are you planning to do ?",no_emotion
Just get out of my face !,anger
That's hilarious ! What did he say ?,no_emotion
"He was standing there, they went up to him. Like have you not watched the video?",no_emotion
"come off it , It's not that serious . You should DIY ( do it yourself ) sometime .",no_emotion
"Hello , Bobby , It seems that I can't arrive at your home by 12 o'clock .",no_emotion
"I would shoot a cop who shot my animal. Save the consequences for later, you just assaulted and possibly mortally wounded my best friend. ACAB",anger
Ok I love [NAME] for making [NAME] fist bump 3 times. He was so awkward with that haha.,happiness
"With the development of the society and technology , radio is nearly everywhere .",no_emotion
"I'm surprised they play the national anthem at derby bouts there, been to many bouts in Minnesota and haven't once heard the national anthem performed.",surprise
I said this somewhere else.. but I swear that man in the hood is caucasian... But that was actually hilarious,happiness
Omg two little blankets for your penis. LOVE THAT.,happiness
Do you have reservations with us ?,no_emotion
"The views that are pro-apartheid and pro-ethnic cleansing are illegitimate, whether or not they are “[RELIGION] views” doesn’t matter.",no_emotion
True. Here the mistakes has already been made. Please don't mess up for us who are looking for an alternative refuge to Israel.,happiness
I know how you feel and I’m sorry you’re going through that. But I’m glad you are still here,happiness
"No , I can ’ t accept it . Business is business .",no_emotion
I love that kind of stuff .,happiness
"Thanks, didn't know that",happiness
Do you think you can send somebody over to fix it ?,no_emotion
"Apparently those corpses, along with hideouts, are the only ones that can give you treasure maps",no_emotion
Kk cause I love touching up my tops so I'm just making sure 😂 &#x200B;,happiness
That's good to know . We'll watch for crazy drivers .,no_emotion
"Well , let ’ s plan to get together next Monday afternoon , around three ?",no_emotion
[NAME]? Looks strangely like Five Points to me.,no_emotion
"If you make mistakes in your job , you'll be fired . Is that right ?",no_emotion
Like Palestine only larger.,no_emotion
Health insurance company and policy No ?,no_emotion
I stuck a bit of glass up there. It was a pane in the ass.,sadness
Then why are you commenting on a thread about that article?,anger
No I'm saying you can't love someone else if you don't love yourself. ...,no_emotion
No . What did it say ?,no_emotion
"Now , I've got it . Thank you .",happiness
Oh no! He’s right!,happiness
I can’t think of any at the moment but I just wanted to say I love [NAME] lol.,happiness
"This one is by [NAME]! Your suggestion was funny to me, and you've been blessed with your joke being DR Onion #20!",happiness
"That's horrible, good to know she is with an awesome guy.",happiness
Is the driving test difficult ?,no_emotion
That’s about all you can ask for these days.,no_emotion
I saved up for a top hat recently and it turns out not to fit as I have a large skull. Thanks for your kind words.,happiness
"Welcome back racing fans ! My name is Rick Fields and , as always , I am joined by my partner in crime , Bob Copeland .",happiness
Is that OK ?,no_emotion
I'm going to buy a newspaper and check the classified ads .,no_emotion
I just got off the phone with my boyfriend . He is always getting upset and losing his temper over nothing . It ’ s so hard to talk to him at times .,sadness
"Autumn is the best season in Beijing , you know .",happiness
Try really warm water instead. It's awesome.,happiness
come on ! three's a crowd !,no_emotion
It's pinned on the sub.,no_emotion
"Yeah, and you don’t learn fine intricacies in a tutorial. You learn them through playing. You’re arguing a strawman now. ",no_emotion
"Excuse me , would you get me some paper napkins ?",no_emotion
Don't ask such a question . You know it has no certain answer . Everyone knows it is in his heart .,no_emotion
Give it to me .,no_emotion
I see . May I know the schedule ?,no_emotion
"Thanks again . You look nice today , too .",happiness
Jim !,no_emotion
Ambien your posts are delightful and I have such a hard core internet stranger crush on you.,happiness
What about the damage to my car ? What are you gonna do about that ?,no_emotion
"I ’ ll have to think about that , Ms . Solomon .",no_emotion
"Somewhat valid question, if he was 11 when the game came out then he can shut up yeah.",no_emotion
"I want to give my peers money, so they can fight for my rights and privilges- see the bus pass discussion in this thread. ",happiness
They must have got in through the kitchen window .,no_emotion
"Because the universe is dumb and not fair, but we can make it less dumb",happiness
Would you care for coffee or tea ?,no_emotion
"Well , now you're really going to freak out when I tell you who aced it ... what's-her-face ... the one who always kisses up to the teacher .",no_emotion
"Oh , it's a reserved opera named The Monkey Creates Havoc in Heaven .",no_emotion
May he Rest In Peace.,no_emotion
Gotta love that good old libertarian to fascist pipeline.,happiness
"Black , of course .",no_emotion
"Meh, I'm actually pissed at some of the people I usually defend for getting excited about this too.... we did lose our data.",sadness
"There was an article about it in E news. I pray for everyone, no one is above that or below that. ",happiness
"Well , let me see . I'd like to go to the Great Wall , the Summer Palace , the Forbidden City and the Temple of Heaven .",no_emotion
His opponent got DQ for pinching off [NAME] air tube. His first opponent is why [NAME] had the air tube in the first place.,no_emotion
It's no trouble at all .,happiness
Awesome! Thanks! I'll start the process tomorrow!,happiness
"Rude ? You weren't rude at all , Annie . Why do you think you were rude ?",no_emotion
"No , really ?",surprise
Especially weird considering [NAME] went to Fresno State and [NAME] went to Long Beach State.,anger
"Hey [NAME], I'm [NAME] ! :) ",happiness
"That ’ s good advice . I should also be careful about giving out confidential information about myself , such as my password and credit car number .",happiness
"As it's confidential there is a certain amount of red tape , but it shouldn't take too long . There is , of course a service fee of 300 RIB to be paid .",no_emotion
I see . I guess that makes sense .,no_emotion
"Not really, in my mind it was continuous cringe that I was always curious about",no_emotion
The true horror of modern democracy is enabling those who say pork roll to have a voice.,anger
My birthplace is Suzhou .,no_emotion
$ 88 for a single ticket .,no_emotion
Where do they grow mangoes ?,no_emotion
Really ? OK !,happiness
