text,emotion
It's very simple actually . You can go to the service centre and have your name and job interest resisted . They will give you a call if any job comes up .,no_emotion
Flip him for another 3rd rounder hah,happiness
How long do you expect to stay there ?,no_emotion
"Yes , Please.It ' s very kind of you .",happiness
Good idea . How much do I need to deposit ?,no_emotion
Locking a bunch in a kids in a room with their pedophile priest is fun af? You need help.,happiness
Most of the time that is what I prefer .,no_emotion
"Ah , that's a good idea . But I heard the film club of our school would show a film for free . Maybe we don't need to go to the cinema .",no_emotion
It was nice talking to you too .,happiness
May I help you ?,no_emotion
Lol ok. So saying a garbage clip doesn't belong at the top of a gaming subreddit makes me a [NAME].,happiness
Where are you going now ?,no_emotion
"It's OK . I'll leave the pamphlet here . If you need more information , you can call me any time .",no_emotion
Of course . We have three different plans with different prices you can choose from . The first one is the cheapest but most basic plan which is thirty dollars a month . This is for broadband internet with a download speed of five hundred and twelve kbps .,no_emotion
Does it include bonuses ?,no_emotion
I like your sleeves... they’re real big,happiness
With the way [NAME] has been playing I’m just hoping it’s not a coincidence that [NAME] is playing well too.,happiness
"well , I'm looking for some summer clothes .",no_emotion
"ADD is also a DISORDER And yet no one crys ""Why oh why does my kid have ADD? WHAT DID I DO WRONG?!""",no_emotion
"Hi , Ms . Seymour ? It ’ s Allan Parker . I ’ Ve been waiting to call you and thank you for all your help last week .",happiness
"Come in , Arnold . Have a seat .",no_emotion
Wish him to be healthy soon .,no_emotion
Does it bother you that your husband goes away on long business trips ?,no_emotion
I know . It's a mix of all the latest songs .,no_emotion
That's about five blocks . And around corners too.So he was definitely following you .,no_emotion
How often is the bonus ?,no_emotion
I'm going to America .,no_emotion
I ’ m trying to learn new skills . It makes me more qualified for a good job .,no_emotion
Cute! And similar coloring to mine. :),happiness
How about the working hours ?,no_emotion
This is borderline experimental,no_emotion
"Maybe if we didn't choke to inferior teams we could've made the playoffs and done something about it. But of course, we didn't so.",no_emotion
I can do either one .,no_emotion
I don't think so . All the souvenirs of the Olympic Games are very hot right now .,happiness
I'm from Shanghai . And you ?,happiness
You have to help to the laundry today .,no_emotion
you look pretty upset . Are you ok ?,no_emotion
"Well , I see . And what about the vacation in our company ?",no_emotion
"It's very hot , the temperature is often over 40C .",no_emotion
Had my suspicions but didn't want to mindread such a civilized honest actor.,no_emotion
Good job [NAME]!,happiness
What's the Mountaineering Club doing this weekend ?,no_emotion
He said he had to get rid of them . They were stolen .,no_emotion
What material is it made of ?,no_emotion
"Medium rare , please .",no_emotion
Hello ?,no_emotion
Can’t see him doing well in the premier league tbh. Wouldn’t be surprised if he ends up wishing he stayed at Dortmund.,sadness
Vote for a commie and she will be making that decision.,no_emotion
"Ok , tell me .",no_emotion
Where are you going ?,no_emotion
What did you watch ?,no_emotion
**[NAME] intensifies**,no_emotion
How may I help you ?,no_emotion
"Yes , I suppose that's the best thing I can do for now . I'll be here on Thursday morning at 10 o'clock . Is that all right ?",no_emotion
"Oh , I know . Thank you . Professor wang .",no_emotion
Ok .,no_emotion
That basically means this site steals and sells your data so they don't want to make it GDPR compliant.,no_emotion
Have you got any better ?,no_emotion
"I can handle that . I can operate word - processor , fax machine , photostat , and other office equipments .",no_emotion
Do you want an IBM-compatible PC or a Macintosh ?,no_emotion
Yeah! Despite being from the east coast I've never been in the car when it's hailing so it was a full on argument. Thank you!,happiness
"Well , I think Clinton deserves high marks for doing his job generally , but he may get low marks for his honesty and personal image .",no_emotion
"OK . We offer 2 types of saving systems , Time Savings and Demand Savings . With Time Savings your money cannot be withdrawn for a certain period of time , but with Demand Savings your money is ' on demand ' , you can withdraw at any time .",no_emotion
No one is required to help anyone.,no_emotion
It's really there ? This all seems so surreal-like it's all one big nightmare .,sadness
"Oh man, I just realized my city taxes are paying for [NAME] nonsense! ",no_emotion
"We appreciate your intention , but the amount of your orders last year was moderate .",no_emotion
C :: I ’ d like to have this roll of film developed .,no_emotion
Happy to see you .,happiness
Yes . I'd like to look at lipstick and eye shadow .,no_emotion
Let meet this right — — do you want to buy the house ?,no_emotion
"And here is my personal favorite, “To weigh one couple’s pathetic-ness against the others is to split the hairs that [NAME] collected.” Truth 💆🏽‍♀️",happiness
"your table's ready , sir ? Please step this way .",no_emotion
I can't believe he used the N-word.,surprise
People went out and looted ?,no_emotion
"Since the internet isn't broken , your connection must be messed up .",no_emotion
Suit yourself . Don ’ t forget to set the alarm clock .,no_emotion
"Yes , we do . They are eight yuan per kilo .",no_emotion
Does he report it to the police? I didn't see that part. I believe him. Stranger things have happened.,happiness
"Looks wise you sound dateable but no, I wouldn't date you, because you seem to have an overemphasis on appearance",sadness
I know! So relieved.,happiness
I heard they were just married for half a year .,no_emotion
I thought this was a torb skin and I was about to die,fear
He is in the bedroom and fallen asleep .,no_emotion
"Let's see, collectivized commons leave less grass on the ground and wreck the economy. Nope. The tragedy of the commons still holds true. Try again.",happiness
Have you gotten a parking ticket before ?,no_emotion
Yes it is . Thank you .,no_emotion
Really ? How so ?,surprise
Oh I didnt know the box was stabbed. It kinda looked like they made a little holder for their knife so they could come back to it later.,no_emotion
Yes . I really need to have a good rest .,no_emotion
"She's as tall here, in giant heels, as [NAME] is without shoes so I'm betting on not tall.",no_emotion
Here you are .,no_emotion
They're quite popular now . Wasn't her voice good ?,happiness
I don't define myself by my sexuality. Conservatives who want to kill me do.,anger
[NAME] is watching this post in july 12th 2021?,no_emotion
You ’ re welcome .,no_emotion
"That won't happen again , I'm sorry .",sadness
Collab on the way?,no_emotion
It was such a strange error.,surprise
"Stay away from her kids, [NAME]!",anger
You are going to be such an adorable father ! Tell me about this school .,no_emotion
Thanks . Could you take one more from this angle ?,no_emotion
Who is the guilty party ?,no_emotion
How much do you want to pay ?,no_emotion
"No , we don't do that here . We recycle polyethylene and we make it into other products .",no_emotion
"There have been so many dry winters lately that it's about time , don't you think ?",happiness
"Hypothetically if [NAME] makes a run with foles and decides to trade wentz, I’d give up [NAME] in a heartbeat",sadness
"OK , I think I know what to order for my lunch now . But , eating too much fried food really makes me fat .",no_emotion
Nobody is really on about anything.,no_emotion
It can't be true .,happiness
The denials is crazy in here,anger
"He probably misread it as *gunst*, he didn't come here for gunst.",no_emotion
Mr. [NAME] Moderate himself. I do hope the DCCC pours money into [NAME] rematch campaign when he declares.,happiness
Just look at Speedwagon. That man is... a beauty to say the least.,happiness
"OK , ma'am . Calm down , 15 dollars will do .",no_emotion
I like these shoes .,no_emotion
Thank you .,no_emotion
Have you been coming to this Laundromat long ?,no_emotion
Yes . She believes everything about him .,no_emotion
At this rate we will be.,no_emotion
He's out of John's hands . Nothing he can do about such a black sheep .,no_emotion
"Wow , American football is more exciting than I thought .",no_emotion
yes it does.,happiness
I don ’ t think she will do such a thing .,no_emotion
He dresses that way in real life...perfect,no_emotion
"Its gross area is approximately nine hundred square feet . There's one living room , one dining room , one master bedroom and two other bedrooms .",no_emotion
"It looks like it , he ’ s getting up .",no_emotion
It sure is ! The water looks so nice ! Anchor the boat for a little while . I ’ m going to take a dip .,happiness
"No , I'm not feeling myself . I just want to check my emails , visit my favorite websites and chat with my friends .",no_emotion
Have you packed our passports ?,no_emotion
I don't think that will do . How about the one at your back ?,no_emotion
"Yes , quite right .",happiness
We charge ten cents a copy .,no_emotion
What time would you like ?,no_emotion
No . I am a transit passenger going to Sweden .,no_emotion
"Bobby ! Come here , look what I got you !",happiness
"You can cash them here , how much do you want to cash ?",no_emotion
Okay. Have a nice evening! 👍🏻,happiness
"No , I won't get sick . I promise . Ok . I've finished . Bye , Dad . See you !",no_emotion
"If you like to help me do the dishes , I'll be more dreadful .",happiness
It's shaped fine. It fits her. It looks great and I'm jealous.,happiness
I find it really strange how people align themselves with or against a politician so strongly.,surprise
"No , I'm not asking for money , I'm asking for your advice .",no_emotion
"Wow it looks like we held our own negotiating here, nice to see.",happiness
it seems the department still has some money left in the budget . Do you have any suggestions how to use it before the budget is renewed ?,no_emotion
"I won't be too long , I suppose . Just let me ring them , will you ?",no_emotion
"Don't worry about it , but thank you very much .",happiness
[NAME] doesn’t care if you drink tea. I would tell him how you feel. Keeping you in my thoughts.,no_emotion
He’ll have ptsd every time he sees a cheeseburger.,no_emotion
yeah fuck you too okay,anger
Is that the latest issue of Reader you're reading ?,no_emotion
"I'm afraid that he can't , Mr Croft . Can't you wait till this afternoon ?",no_emotion
The argument [NAME] is making is that expecting women to cook is considered sexist but expecting men to shovel snow is fine. It's about the double standard.,sadness
Really ? How long did it take you to find a spot yesterday ?,surprise
"Nope! His real name starts with a G. Weird spelling of a common name, and pretty identifiable so I’ve never wanted to use it 🙃",sadness
Why ? You ’ re not satisfied anymore ?,surprise
"Sure , but this week is crazy for me . Can we make it next Monday ?",no_emotion
That's not nice .,no_emotion
I should like to look at some bracelets .,no_emotion
This is John .,no_emotion
"I hope you can make a clever choice . Anyway , the opportunities around you are not that By .",no_emotion
Probably not making good pass decisions.,no_emotion
I think the popularity of Alliance confirms my point about radical centrism on here,no_emotion
We have freeish speech. If you can be prosecuted for something you say then you can't in any way that we have free speech.,sadness
"First , she needs to be hard-working . Second , she has to be able to do a lot ot things on her own initiative .",no_emotion
I see . Is this yours ?,no_emotion
"Don't worry, I'm pretty sure you're right and he's wrong ",happiness
"As a [NAME], I would like to extend an apology to anyone freezing in the polar vortex. ",sadness
"Wow , that's cutting it close ! That means we only have 25 minutes to make the connection ! What gate is it at ?",no_emotion
Let's put our suitcases on the rack .,no_emotion
Any time . But I don't mind eating boxed lunch . The food sanitation is really good too .,no_emotion
You took the **bait**. Unless you masturbated to it.,no_emotion
It did have an awesome geocache lol,happiness
"Doctor , I have a bad cough and a headache .",no_emotion
Yes . You are free to do temporary business with this visa . If you were planning on setting up a new business in the U . S . you might need to apply for a long-term visa .,no_emotion
I had no clue that I could get it there .,no_emotion
Hi ! How are you doing ?,no_emotion
What do you plead ?,no_emotion
"Well , I want to discuss with them the new control we said last week .",no_emotion
"I am sorry , I didn ’ t catch what you said . Could you repeat it please ?",no_emotion
"Listen , John . I understand that you are such an excellent student and I know you must have lots of stress , but you really want to give up ?",no_emotion
Wonderful . It is a home for foreign students .,happiness
That sounds fine .,happiness
"Well , the weather is so unpredictable this time of year .",no_emotion
That song was epic live,happiness
[NAME] game sucks. He's good at comps but his strategic game is awful,happiness
"I want to put my knowledge and experience to use in a challenging position . In order to achieve this goal , I just want to work step by step .",no_emotion
that was absolutely beautiful,happiness
I heard it .,no_emotion
About two months .,no_emotion
They are all great skiers and very experienced . So I suppose the chance for them to be buried by an avalanche is slim .,no_emotion
Some people on here are infatuated with his infatuation.,no_emotion
Do any of them have dancing figures ?,no_emotion
"Those are company cars provided to the sales staff for their business trips . Also , some employees receive sales commissions . So good salesmen will naturally earn more .",no_emotion
Oh dear . I don't have it with me . Do you take debit cards or should I pay with cash ?,no_emotion
Because it helps you speed up your circulation .,no_emotion
Good thing they were all about to jump when it happened. Do you know what happened to the pilots?,no_emotion
First class or economy ?,no_emotion
Who spend 54% of his life in jail because of crooked cops.,no_emotion
"Yes , I haven't seen you for four years.How time flies !",happiness
105 strikeouts over 81 2/3 innings. that's good lol [NAME],happiness
That's a good word to describe it .,no_emotion
"No , he doesn't . But his wife found out he has been too charming for a long time.Incredibly , he has many different girlfriends . Starting almost right after they married 20 years ago .",no_emotion
We need a person with ability and flexibility .,no_emotion
"Yeah , that's a good idea . Let me try it .",no_emotion
"No you don't, you love lies and liars. ",sadness
I came in here to ask why he’d drive so far to see a movie about testicular torsion,no_emotion
"On , what ’ re you doing ? You look as busy as a bee .",no_emotion
I wouldn ’ t miss it for the world ! It ’ s sure to be fun . She ’ s invited a lot of people . Do you think everyone will be able to get into her house ?,no_emotion
"Me , too , haha .",no_emotion
I feel this. For me since I’m using those gamethreads to let out frustration but realistically I know we need to keep patient in this re-rebuild,no_emotion
"Actually , you cannot mail it in early , as it needs to reflect all of the information up to the due date .",no_emotion
Can't clear anyone of something that never happen or that they never did.,no_emotion
"No , I knew it all along . He was the obvious choice .",no_emotion
Make sure that you understand the company . Do you understand what it is that they do ?,no_emotion
"No . I listened to records and studied , what did you do yesterday , Donald ?",no_emotion
It ’ s about six or seven miles . That ’ s about ten kilometers .,no_emotion
"Hey , chill out , I'm just trying to help .",no_emotion
"ok , I'll try and put you through . Please hold .",no_emotion
"Troo, troo....worse eban dan eat pizza wif aht a ferk. ",disgust
"Needless to say , as a Westerner , it's bread .",no_emotion
How many can we choose ?,happiness
"Yeah - we never had a fight. I'm glad we managed to end it in good terms. Thanks a lot for the sentiment, mate. Cheers!",happiness
"It sure looks special , looks expensive too .",no_emotion
Not really. My group of friends are awesome in every way possible except they are homophobic,sadness
"They're similar to an avocado . When the outside feels soft , they're ripe .",no_emotion
You don't need to worry about that .,no_emotion
"In spite of this , international business contracts and arrangement must be precise , specific and all-inclusive to lessen misunderstanding , misconceptions and disagreements to the minimum 。",no_emotion
What ’ s that ? It gets the name from the festival itself . That ’ s really funny !,happiness
"It's been deleted, we can't even see what it was now (unfortunately). ",sadness
Here it is .,no_emotion
"If you want to be macho , order a double shot of espresso .",no_emotion
"Yeah , yeah , I know what I selected . Just gimme my money !",anger
"Yes,on top of that feel like vomitting,can't breathe and thinking I will faint.",fear
Was she prepared to throw the gun?,no_emotion
I feel like I'm in a yoghurt advertisement announcing how my digestive system is all rejuvenated. Its that wholesome.,happiness
Addison .,no_emotion
"Excuse me , Mr . Li . I have something to discuss with you .",no_emotion
"I ’ m starving , too . There is a new Chinese restaurant close by . Do you want to go there for lunch ?",happiness
They went to their stores to get one . Here they come with it now !,no_emotion
"Sorry , I can ’ t.My mother doesn ’ t want me to be late . I really have to go .",no_emotion
Don ’ t worry . There ’ s plenty of time yet .,no_emotion
"""AaaaaAAAaaaAAAhhh!"" I can imagine.",happiness
Think they fly in tonight or tomorrow?,no_emotion
Salary is based on experience as well as time spent with our company .,no_emotion
Why thank you sir!,happiness
You wouldn't do a thing like that !,no_emotion
"Glad to meet you , too .",happiness
My Chinese friends told me that the Spring Festival is coming soon . Can you tell me something about it ?,no_emotion
All of the Chinese are proud of the Great Wall . And it was built before the In dynasty near Shan Haiguan-the First Pass in the World .,no_emotion
Lmao you fart bigger to cover up the first one,happiness
Welcome to Al ’ s Garage . What seems to be the problem ?,no_emotion
Let's take a cab .,no_emotion
"Okay, I'll try to find one. Sorry about that.",sadness
And it’s only 100 degrees with 90% humidity.,no_emotion
It's my heart ; it's made of what you like .,happiness
From July the seventh to the ninth .,no_emotion
"Nice to meet you , Andrew . I am Noirin , Noirin O'Neil .",happiness
"Just a minute , Sir.Are you Mr Wang from China ?",no_emotion
Good morning . I'd like to pay my bill .,no_emotion
That ’ s good news . The good thing is that most people treat their pets well .,happiness
"Alright . With shipping charges , your total will be 68 dollars . Will you be paying with credit ?",no_emotion
"Sure , that ’ d be great.Where would you like to go ?",happiness
Then you also need to be aware of the time limits on the street signs . Have you seen those signs ?,no_emotion
I like that Kenmore refrigerator .,no_emotion
"Yes , I think so . My friend once used it mostly to play chess , but now he has learnt how to do other things on the Internet .",no_emotion
My grandmother said there was snow once when she was a child . But my parents and I never see it outside of my city .,no_emotion
I wanna see this line up... not cause I think we’ll win with them but i just want to see it. [NAME] [NAME] [NAME],happiness
I hope she will. I will regret it until she does and even after that I may still regret all I did.,happiness
"See, I missed it completey, so they must have glossed over it fast. ",sadness
"It was never about comparisons, it was about our experiences and relationship to capitalists here.",no_emotion
"Tea Ceremony ! It's , there's a certain way you have to make tea , not only make tea , there's a certain way to for example wipe a bowl .",no_emotion
This is amazing. Love these edits.,happiness
#cooking #uni #urchin #local #tidetotable #truecooks #seafood #cheflife,no_emotion
I suppose a proposed a law needs the support of the big political parties .,no_emotion
"Because the job I am doing in my present company is of no challenge , but I like challenge.Your firm is a young organisation with many innovative ideas . It has been very successful in an expanding market since its establishment 10 years ago . Working for you would be exactly the sort of challenge I am looking for .",no_emotion
"Happy birthday kiddo, free updoot for u",happiness
I make friends not clones.,no_emotion
I won ’ t be able to fix the pipe until tomorrow .,no_emotion
I am going on a business trip to Guangzhou next Monday morning .,no_emotion
What ’ s happened ? Is there a problem ?,no_emotion
GET MORE GOALS FUCK [NAME],no_emotion
"I don't think WI is lean red, after 2018 I'd argue for it being either tossup or lean blue.",sadness
I'll put it into context. I love DBZ. I hated Battle of the Gods + Resurrection of Freeza. I *fucking adore* Super Broly.,happiness
Very well said.,happiness
"Yes . How are you , Anna ?",no_emotion
“But [NAME] wants you to have kids!” [NAME] should have given me ovaries then lol,happiness
"Take it easy , maybe tomorrow will be different .",no_emotion
"Oh , they all went out ! Did you make a wish ?",no_emotion
"This "" Cream of Olives "" is our bestseller for combination skin . You can try it on your hand .",no_emotion
I am pleased to report that my 5 win streak was broken.,sadness
Inspection is to be done by the China Commodity Inspection and Testing Bureau . Usually inspection is conducted within five days before each shipment .,no_emotion
"she disrespected [NAME], i dont like her",anger
"Phsyically, not mentally or emotionally. It's literally only been one week since the end of episode 2 and the start of episode 3.",no_emotion
Don't worry about it . I need to have something done about those bushes .,no_emotion
We either bout to get a road win or have another historical collapse,no_emotion
Room service.What can I do for you ?,no_emotion
"All right . This way , please .",no_emotion
What ‘ s the minimum amount I can deposit in an account ?,no_emotion
What time do you have ?,no_emotion
It's a lot better because it doesn't tie up your phone line .,no_emotion
"It's very dangerous , you know .",no_emotion
Thank you! I’ll contact you tomorrow! :),happiness
And next ?,no_emotion
Hell with it ! Nobody will give it an Academy award !,disgust
"Yes , I even can't fall asleep these days .",no_emotion
It sounds that sandstorms are trouble for everybody !,no_emotion
"Best pen in baseball, even though I'd still take [NAME] over [NAME].",happiness
What are your salary expectations ?,no_emotion
Are you thinking about a public school or a private one ?,no_emotion
"This way please . First , we should clean your face with our clarifying cream . And then we use the massage cream . Next do the massage . I hope that you can feel comfortable .",no_emotion
All right . I'll take it .,no_emotion
can I read it when you ’ re done ?,no_emotion
"You can't post a Sons pic and then say ""I got this"", that just hurts.",sadness
What’s a matter? I thought you liked faces.,no_emotion
I don’t think his clothing was so tight when he purchased it..,sadness
Thank you for repairing it .,happiness
"What are you doing now , Steven ?",no_emotion
How does it actually work? Thanks for the response; aspiring entrepreneur with no knowledge of corporate finance,no_emotion
Take it easy . We should be able to make it unless we get caught in a traffic jam .,no_emotion
"Get em chief, fuck em, I find those people annoying as hell and I barely even use Instagram/twitter",anger
Very well . We have some fresh red roses .,happiness
"Typical humans, diminishing dog's accomplishments. ",sadness
"Linda , this is Todd calling .",no_emotion
"That’s what the shake is for, though. ",no_emotion
Oh look - it has started to snow!,no_emotion
Don't look a gift horse in the mouth ! That was the best they had .,no_emotion
"Now , that's a price that I like .",happiness
"Yes , Ma'am . No magazines during the office hours . I'm sorry .",no_emotion
1 coupon for a honey butter chicken biscuit and double cheeseburger Whataburger meal coming right up.,no_emotion
"""Oh, how DARE you discuss the disgustingly unhealthy and dangerous lifestyle I pursue!"" /s",anger
"OK , lovely boy . Try to be patient . Do you know the danger of swimming without warm-up ?",no_emotion
#BUTTLICKER!,no_emotion
"I might be a prude. ""Suck him off in the bathroom of your friend's home!"" Those don't equate",anger
"ok . I'll stay home this morning and rest , but if I feel better in the afternoon , I'm going to the meeting .",no_emotion
"Yeah, it'll be a pretty strong 3 team race among the Nats Braves & Phillies! It'll be fun to watch it from afar!",happiness
Grannie always tries to stay fit and healthy . She is always making us kids eat the proper foods .,no_emotion
Seriously . The only tax I don't mind them taking is social security . It's only a few dollars every paycheck .,no_emotion
"No , I didn't .",no_emotion
"The cake is no problem at all , but we do charge a corkage fee of $ 15 a bottle for any alcohol not purchased from the restaurant .",no_emotion
