text,emotion
it certainly was a great party . It ’ s a pity that a glass and a plate got broken and someone spilled a drink over here .,no_emotion
I don't know .,no_emotion
Would you please tell us how to review our lessons ?,no_emotion
We are out at the moment . May I suggest some rye bread ?,no_emotion
I'm afraid I'll pick something else.,fear
Yours is the most interesting and thought provoking comment yet.,no_emotion
"Get involved and take others with you. Part of the only way we’re going to get better options, we’ll get there!",no_emotion
Welcome to Lincoln Bank . What can we do for you ?,no_emotion
Here's twenty dollars .,no_emotion
"Yeah , Richard said something to me that I didn't appreciate .",no_emotion
That happened to my oldest girl . She became really upset when her classmates told her Santa wasn't real .,no_emotion
Could I ask the company for the housing ?,no_emotion
Yes . Then cross the road at the next traffic lights . The Peak Tram is straight ahead . You can't miss it .,no_emotion
"Wow, are you me? No one is a fan of season 1 but I definitely do this. There are little gems despite [NAME].",surprise
"Honestly Texas deserves to win with they way they’re playing, they clearly came motivated and they’re outperforming UGA on both sides of the ball.",happiness
Could I get back the sweater you borrowed ?,no_emotion
Are you staying at the Hilton ?,no_emotion
I'd like it to be charged to my credit card .,no_emotion
How about a laptop ?,no_emotion
I see .,no_emotion
"Sounds good . Okay , that ’ s it .",happiness
"You can say what you want about USM, but we love our baseball.",happiness
What are your salary expectations ?,no_emotion
"Sure , I ’ ll just go put the kettle on . Why don ’ t you have a seat on the sofa and I ’ ll go take care of things in the kitchen .",happiness
That's just a tad frosty. I'm ready to ice skate to work on thursday amsterdam style.,happiness
Source? Wouldn't doubt it's possible though games like BDO can get pretty nuts with whales.,no_emotion
But you have already worked there for five years .,no_emotion
"Oh, but it is.",no_emotion
ok thanks I'll give it a read and try to fact check,happiness
Oh look another shit call,anger
"Oh , very good . I will buy this one .",no_emotion
"Now , many people think that women ’ s liberation is a kind of civilization , but children are getting less love from their mother because of that . What is your opinion ?",no_emotion
maybe . I haven ’ t been able to keep my food down either . That ’ s unusual .,no_emotion
I'm not quite positive . I think I went out at about half pass nine .,no_emotion
"I will help to prepare food , feed animals and clean up . I ’ m very excited about it now .",no_emotion
Excuse me . Can you tell me where l can buy a notebook and a pen ? I need them badly .,no_emotion
"Don’t know why I didn’t think of that..but hey thanks, hero!",no_emotion
"Thanks a lot . By the way , do you make the deliveries ?",happiness
You’ve got the slight shit-eating grin of a long-tenured predatory priest with immunity due to inside dirt on the bishop.,no_emotion
I love this idea,happiness
The suspect is number four .,no_emotion
[NAME] stands a solid chance honestly,happiness
Don't worry about it . Try to look on the bright sight of things .,no_emotion
I ’ m just looking for a nice pillow on Ebay .,no_emotion
Uncle and niece? Man nooo noo,no_emotion
But I just want to give her some tips .,no_emotion
Happy New Year.,happiness
With the shipping included--seventy dollars .,no_emotion
"Oh , I am very sorry , Hans . Thank you for waiting for me . You must have been here a long time already .",no_emotion
I need to make a withdrawal .,no_emotion
I just saw a post above this about people getting offended by jokes too easily,no_emotion
Don't mention it .,happiness
"I have it on highest authority that this traditional secret recipe has been handed down in the Granger family for generations . I ’ m sure you can keep a secret.Buttermilk , cacao beans , sugar and Haggis .",no_emotion
Because I want to tell you about the time that I saw a ghost .,no_emotion
"Sam , I am so sorry . It was your birthday yesterday and I completely forgot about it .",no_emotion
do you remember where you were for the terrorist attacks on 9-11 ?,no_emotion
Nope . I guess something might have come up .,no_emotion
"Another nipple man, we should form our own Subreddit",happiness
Addressed this elsewhere but I was mistaken. Thanks for the correction.,happiness
"She thought the fuel pump was cold and decided to try warming it up. You know, to prevent the gasoline from freezing and causing blockage.",no_emotion
I see . Has she read any detective stories ?,no_emotion
Cuz some things could become brittle and break...,no_emotion
"Well , just something in general , like several key steps in planning career and how to set specific and tenable goals .",no_emotion
Happy for u!!,happiness
bleh. You would think 160 reps in and I wouldn't have that problem. Thanks for the insight.,happiness
This is an interesting opinion that I want to brainstorm some more. I'd like to see a study on how global warming would affect Canada's habitability.,no_emotion
"A new car . And I've got a small family , two children , and I haven't got a lot of money and ...",no_emotion
I want to know if the staff can get a vacation every year .,no_emotion
I'll take this one .,no_emotion
.... You do realize they will eventually hit a glass ceiling since that's unsustainable.,no_emotion
"My wife's birthday today, we are going for dinner with my lovely girlfriend later, after meeting at ours for coffee and cake. Very happy",happiness
also anxious that people will be angry or surprised or upset at me for me never telling people about this before,fear
"Agreed, that’s different if it’s their choice, but I would suggest against starting off that way!",happiness
You are delusional if you think big oil and existing deeply entrenched and rich traditional energy can’t pay scientists more money than new renewable energy can.,sadness
I would honestly say maybe your son just realised how bad his parent is.,no_emotion
Fill it up . I will have a tour tomorrow .,no_emotion
They're wrong I don't like math and I'm still ugly,anger
"Yes , of course.When ?",no_emotion
Yes . I bet my bottom dollar that he will get promoted .,no_emotion
That's nice . Where is his villa ?,no_emotion
"Translation: ""I have no argument so here's a rude comment"".",anger
"Did you work as a salesperson before , Mrs.Vale ?",no_emotion
"Okay , let's go !",no_emotion
you're welcome .,happiness
"Your daughter usually does the dusting , and I do the vacuuming .",no_emotion
There is a desk and two chairs .,no_emotion
Most people have no side effects . You will have to make sure that you drink plenty of liquids with this medication .,no_emotion
Where are the frozen pie crusts? Can you call someone on that (handheld)? Can you get me a fish?,no_emotion
I didn't know you liked old movies .,no_emotion
Feels like im wearing nothing at all!,sadness
Excuse me . Mr . Li . May I ask you some questions ?,no_emotion
That’s awesome man!,happiness
"If by discount you mean free, yes I do.",no_emotion
Did you get the camera ?,no_emotion
You shouldn ’ t be nervous about that .,no_emotion
:( im sorry,sadness
"I'll say no thanks to endangering others in traffic. And miss me with the ""I drive better while high""",sadness
"Don't fight reactionary idiots in public sure sounds a lot like ""sit down and shut up"" to me",anger
Good evening.Welcome to our program .,happiness
Where would you like to go ?,no_emotion
I'd like that very much .,happiness
"Yes, it can. But I don't think anyone interprets it that way here.",no_emotion
"you're right , thanks . There's an interesting interview with a top director about his latest film that I want to finish .",no_emotion
If you think it is necessary .,no_emotion
That is our office block . We have all the administrative depart - ments there . Down there is the research and development section .,no_emotion
Fine . Thank you very much .,happiness
"Nah , not too flashy .",no_emotion
She’s his problem now.,no_emotion
So the weekend is coming ! How about seeing a film !,happiness
"He never does , and in fact , he seldom communicates with him .",no_emotion
My phone was in the car while I was at the pool in NC and it happened to me guess I am actually in Australia,no_emotion
"Personally, I prefer my seafood not tainted by oil spills. But you do you!",happiness
"And here i am, cant even clean my tongue without gagging... ",no_emotion
"I said in my original text post that I don’t think Venezuela is socialist, and I stand by that statement.",no_emotion
"Season park, was 2 summers ago!! ",no_emotion
"Well , Peter , you have to do better than that next time , won ’ t you ?",no_emotion
Do you think that's a good spot ?,no_emotion
What game do you like ?,no_emotion
"Well , he was playing baseball with some friends ...",no_emotion
"Yes , I will write that down .",no_emotion
This is an issue I had with breaking bad. I love the show but sometimes the actors would talk so frigan quietly.,happiness
I'd like to buy a keepsake for my girlfriend . Could you make a recommendation for me ?,no_emotion
"Oh , it's nothing to speak of .",happiness
I can’t even hear what they are saying.,no_emotion
"That would be very kind of you . By the way , is it a monthly magazine ?",no_emotion
What does it include ?,no_emotion
"The best, besides the hundreds of other games that are better. You know, like how Mcdonald's has the best food in the world. ",happiness
"Do I need to pay anything ? Like a handling fee , or something ?",no_emotion
"Oh , maybe three years . I will study and get the master degree first . Then I will decide whether I will stay there or come back .",no_emotion
I voted for him .,no_emotion
Hopefully [NAME] is still hot,no_emotion
"Heh, don't know how it was back then but I'd really suggest giving it a spin now - it's like life-consumingly good!",happiness
OK . Shall we go to a bar ?,happiness
Poor John ! He is bettering bother sides of this bread .,no_emotion
I'll lend you my gloves and earmuffs until you get your own .,no_emotion
"Unfortunately, I don't. Sorry. 😔",sadness
"Well , he kept on pretending to have a fit , so they freaked out and just ran away .",no_emotion
Wow ! Just the idea of going back to school fills my head with pain .,no_emotion
Can we get a guard too? This is my dream.,happiness
But you're ready for everything else ?,happiness
"I wanted to , but I knew that if I spoke to her , I'd just blow up at her , so I decided to just go home . I called her later that night , but she didn't answer the phone .",anger
"I'll look forward to that , I can't stand queuing .",no_emotion
I really missed you a lot .,no_emotion
Do you think you'll be able to come in tomorrow ? Or should I call off your appointments for tomorrow too ?,no_emotion
"I've been reviewing your work over the past few months . Thanks to your excellent work , we benefit much from your project . And you should get the perfect attendance award too .",no_emotion
For me it’s the complete opposite. Complete dread in the morning and usually more hopeful in the evening.,happiness
I am fully satisfied with the terms of this contract .,no_emotion
Rahway Mechanical LLC should be able to. Great guy,happiness
Is the entrance charge expensive ?,no_emotion
I couldn’t agree with you more!,sadness
Yiddish is such an in-group language that you basically just have to go by whoever you're talking to.,no_emotion
Is IKEA affordable ?,no_emotion
And even then... It won't be for long.,sadness
Nice try russia,happiness
"Not rally . 200 years ago , it was just a small insignificant village .",no_emotion
It is ok with me . I enjoy being busy and learning new things .,no_emotion
For what...,no_emotion
"Yes . Well , I think I'll go get lunch . Will you join me ?",no_emotion
You ams not dildos,no_emotion
"I know , Mr . Emory . I'm sorry . But I really need to see the doctor this afternoon . I feel dizzy and I can't concentrate on my work .",no_emotion
"Nope, but is that a thing people who talk about digestive enzymes over lunch breaks should do? ",no_emotion
Yes .,no_emotion
You have no perspective. Go outside and get some friends.,anger
I am confused by what he said .,no_emotion
"Well , all the drinks including beer are free of charge .",no_emotion
I think so.Thank you .,no_emotion
"A lovely bronze age mud hut, it's a British tradition.",happiness
Follow me . All the things you need as a woman are in aisles 10 and 11 . This section is usually near the medicine section in any supermarket .,no_emotion
Beautiful picture!,happiness
"Thank you. [NAME] killed it, earned his spot. Love my packers but sometimes people in this sub are ridiculous ",happiness
this is the route I thought we could take on our hike on Saturday afternoon .,no_emotion
"Look , I have two tickets.Will you go with me ?",no_emotion
Your comment is completely irrelevant and you're trolling me in order for you to cry and whine about Detroit. Get out of here.,anger
Catholicism did start out as a cult of [RELIGION] at first until it rose to prominence in the world,no_emotion
If we didn’t throw out offers after [NAME] himself has been all over it. Then lynch needs to get checked.,no_emotion
"Yes , but I still can not find it . Maybe it is in this cabinet .",no_emotion
"Hey, buddy, did you get a load of the nerd?",no_emotion
"Well , he drove out , and when he got to the booth to pay the attendant , he pretended to have an epileptic fit , you know , to scare the thieves away . The attendant was no help at all , even though the guys were holding guns in plain view , he did nothing .",no_emotion
So Baltimore is winning ?,no_emotion
I like waitresses. Aren't they swell.,happiness
I am getting to know your meaning .,no_emotion
Sorry about that .,no_emotion
Hmmm.. this is kind of interesting that our name was even thrown into this mix.,happiness
"eh, it has its ups and downs. ",happiness
American food would be the best choice .,no_emotion
"Damnit, you beat me to it.",sadness
"This machine roasts the beans just right . If you roast them too long , or the temperature is too hot ...",no_emotion
THANK YOU! I'm back on planet Earth,happiness
What ! Geez ! How could this have happened ? So what ’ s the bad news ?,surprise
"We've settled price , order , payment , now I am calling to ask about package . How can we pack the goods ?",no_emotion
How is your new car ?,no_emotion
"Yes , I agree .",no_emotion
Whoops . That's my pager . I had to get it for work .,no_emotion
"If he was stuttering the words ""I sell to others and we need to do your time on.",happiness
Where'd the rest of your money for the bus go ?,no_emotion
Cash or credit card ?,no_emotion
"Hi Ron , this is Kim at headquarters .",no_emotion
The weekend's finally here !,no_emotion
"Oh , I ’ m crazy about them .",happiness
I ’ m so frustrated !,disgust
"It's free , but the monthly sticker is $ 24 .",no_emotion
We are doomed,no_emotion
Thank you very much .,happiness
"Fine , just fine.How about you ?",no_emotion
"Yes , I am playing on the tennis team this year , and they are requiring me to get a physical exam .",no_emotion
Just fill out this application . We can let you know right away if you qualify .,no_emotion
"I've heard that when this happens , it's important to save energy .",no_emotion
"Well feel free to ask me anything , and I ’ ll try to fill in the details .",no_emotion
"Well , let's make it this way . For comparison , 10 NM is 1000 times smaller than the diameter of a human hair . There are as many nanometers in an inch as there are inches in 400 miles .",no_emotion
Really .,no_emotion
What time exactly ?,no_emotion
So what's Michael Milliken up to these days ?,no_emotion
"Hi , Mary , I have decided to look for a job as a salesman .",no_emotion
"Not an unattractive man, he’s gonna need real plastic surgery to fix that. ",no_emotion
Oh my god [NAME],no_emotion
Thanks for your insight random person on the internet. Did it make you feel better typing that out lol?,happiness
"Yes , please . and you can cash my travelers check . Can ’ t you ?",no_emotion
Thats even worse than what you put up (no offense really). Your work is well done just a hideous design.,happiness
Okay then. It sounds like you have it all figured out. Good luck.,happiness
"Nope, midwest. I'd bet there are a bunch of shops with the same stuff though. P.S. I love your name!",happiness
Why ? I think it ’ s convenient and good .,no_emotion
Steve Schliessman . S C H L I E S S M A N .,no_emotion
Bears Beets Baseball,no_emotion
I was stuck between 15th and 16th floors in the elevator .,fear
"You work upstair , right ? I think I have seen you before . I'm Karren , Karren Brown .",happiness
I just got got and I like it,happiness
Mr . Thomas is making a long-distance call . Please wait for a few minutes .,no_emotion
"What kind of life do you prefer , city life or country life ?",no_emotion
"No , that's it .",no_emotion
"I said ""try."" Red wine is a thing for a reason",no_emotion
"Daniel , have you ever heard about the wildlife sanctuary ?",no_emotion
Thank you for inviting me .,no_emotion
Of course I did . Here is the receipt .,no_emotion
"Un ... I think it can be a time-waster and it depends on how particular people are about what they want to see ... Mm , it can just be a sort total amusement for someone and totally consuming without reallyconsidering what it is they're watching .",no_emotion
Where were you Bron ?,no_emotion
Please keep the change .,no_emotion
What should I do ?,no_emotion
Did you working in a similar position before ?,no_emotion
You have your ducks in a row .,happiness
What kind of information do you want ?,no_emotion
"Okay , try this one . It's made of aluminum .",no_emotion
Thank you very much !,happiness
"Oh , I love apple pie too .",no_emotion
"It was white, just had some black beads on the bodice. Thanks, that was really interesting! ",happiness
"In a word , cockroaches !",anger
This card has been awesome so far. Great debut for ESPN.,happiness
Hmmm. She is Korean. Based on the early posts I didn't see that one coming.,happiness
I checked there but thank you!,happiness
And there I was blaming the poor black lads,sadness
Why did no one check [NAME] for her comments though?,no_emotion
Your tree looks beautiful . Do you decorate it this way every year ?,happiness
"I don't want to argue with you anymore . This is going to be tough , but Let ’ s try and be friends .",no_emotion
His definition of a grown man is someone who drinks irresponsibly and then beats people up. GET OUT.,anger
The judge wasn’t impartial as decided by the appeal court. The judge needs to be schooled.,anger
its even worse because the starter kit is like $70 too right? So in reality she probably made closer to $30,sadness
"You'll take the blue line until you reach Xizhimen . That's a big station , so there will likely be a lot of people getting off at that stop . You can transfer to the lightrail there , you'll have to exit the subway and present the unused portion of your combination ticket to the Ticketmaster , they'll give you a new ticket to use on the lightrail system .",no_emotion
How much will the three pounds of chicken cost altogether ?,no_emotion
"No , I don't like museums.They ' re boring .",no_emotion
Middle Eastern here and watching this team lose due to silly mistakes at 3-4 am kills me,sadness
At 8P M tomorrow night .,happiness
"Oh , great ! I hope I can spend this Spring Festival with you here in Beijing .",happiness
Thank you . Good-bye .,no_emotion
[NAME] and destroying the OKC thunder name a more iconic duo,no_emotion
Clickin’ it!,no_emotion
Let's see . That would be ¥ 160 a day a mile .,no_emotion
Looks like you ’ re going to lose out on this game then .,no_emotion
"The Canon Eos . Yeah it ’ s ok , but I ’ m looking for something that performs better in low light , has a better display panel , and longer battery life .",no_emotion
Thank you . It's our first date . I hope it's not too offensive .,no_emotion
"And maybe you suddenly have new interests . I mean you suddenly begin to do things you used to avoid . For instance , you used to sleep in every morning , but because she jogs every morning then you begin to like jogging .",happiness
"What , curly ?",no_emotion
I need to take home some souvenirs !,no_emotion
I'm confused...did you do anything? And people that aren't your husbands family or friends are also saying this?,no_emotion
All right . I'll tell him when he comes back .,no_emotion
Maybe write your own music and it won’t get taken down.,no_emotion
"Hmmm.Not good . They ’ re too tight.The length is right , but the shoe is too narrow and it ’ s pinching my toes . And there ’ d be no room for my insoles . You know what ? I don ’ t think I have the patience for this today . They just don ’ t make shoes like they used to . I ’ ll come back another time .",no_emotion
Sounds like fun .,no_emotion
"Not at all , but we don ’ t have a very traditional marriage either , so it suited us perfectly !",happiness
It was with all the other dishes from dinner .,no_emotion
"For real we swept Tampa last season? EDIT: Wow we did, our playoff run against them was a different story ",happiness
Thank you . Here you are .,no_emotion
"I wish I could stay a little longer , but a lot of things to do back home .",no_emotion
Contracts & money in rtts mean absolutely nothing. Just one of the many missed opportunities year after year,sadness
"Actually , I am learning that now . But it's too hard for me . You know the four tones and the stuff . It really freaks me out .",no_emotion
"What happens if I use up my sick days before the end of the year ? If I ’ m sick an extra day or two , will my pay be deducted ?",no_emotion
"Thank you , Anne . You've done an excellent job . Did they mention the date for the next meeting ?",no_emotion
"Well , you sound ill over the phone .",no_emotion
Thanks!!,happiness
Could you tell me now some of the things I need to do ?,no_emotion
"Once bitten , twice shy . He said he would rather keep bach than to live in disgust .",no_emotion
Too bad . I hate transferring during a flight . It is too complex .,no_emotion
Very well . I hope you ' ll enjoy your stay in America .,no_emotion
All right . What is your type of skin ?,no_emotion
"Peter , have you seen my purse ?",no_emotion
In the spring .,no_emotion
You’re welcome! It’ll absolutely be worth it. And it’ll be fun! :D,happiness
"Yeah . I'm still hungry , but I guess it's kind of rude to keep eating while he's talking , huh ?",no_emotion
You should take it twice a day .,no_emotion
It also why there’s a 30 year drought going on 31 this year :D,no_emotion
"Right, but you could execute it without receiving any sort of item or skill from the animal. You could just do it.",no_emotion
"I ... I ... I miss my parents , also they miss me .",no_emotion
"Frankly , some part of it I enjoy very much , but I prefer something more professional . It happens that I have a friend working here in this company . She told me the export department was to recruit an assistant . I felt very excited at this news . That's why I'm here .",no_emotion
Wow. If it shows calls on the bill then what good is it? Glad I asked...,happiness
I stopped reading in the first paragraph where they try to make Vanderpump Rules and Desperate Housewives legit shows.,no_emotion
We are going to have a drink while we are waiting . Please let the hostess know that she can find us there .,no_emotion
we really were lucky . We got the last available table for two---and we didn't even have a reservation ! Did you see the long lines behind us ?,happiness
At the Gate .,no_emotion
"Sorry , I overslept . My alarm clock didn't go off this morning .",no_emotion
I only had time to visit Edinburgh .,no_emotion
And I hear he gives very good lectures .,no_emotion
I have a suggestion . Why don't we go to a ETV and sing ?,no_emotion
"Ah, I see. I wasn’t sure if I was supposed to make contact. Thanks for the info!",no_emotion
No idea . Your guess is as good as mine .,no_emotion
What seems to be the problem ?,no_emotion
Yea but did u see [NAME] pass to [NAME] miss,no_emotion
"If its your first time with dxm, I would take that first and maybe the other drugs on the comedown",no_emotion
Saving for later,no_emotion
"WHERE THR HECK IS VOL'JIN AND MY TROLL EMPIRE, YEARS HAVE PASSED WE HAVE 2 PANDA AND STILL ONE TROLL",no_emotion
"No , this is the medicine for the stomach .",no_emotion
Most of them in this store are from Mexico .,no_emotion
"There is a special exhibition of french sculptures at the museum , I was hoping you ' d like to come with me .",no_emotion
Do you mind telling me your name ?,no_emotion
"Oh , I see .",no_emotion
"Excuse me , I'm looking for your casual short-sleeved shirts . Can you tell me where those are ?",no_emotion
The contestants are different . These girls perform in free styles .,no_emotion
The point is still moot tho so whats it matter,no_emotion
"Are we still taking people who say ""globalists"" seriously? these people should be tarred and feathered and mocked at every turn",no_emotion
Sure it is . This is a changing world . Does the training course cover the new law and regulation issued last month ? They are very useful for us .,no_emotion
bingo!!,no_emotion
His name is Tony and we met my first night in Pathos . He works with my sister who lives there .,happiness
"Well , what did you get in English 101 last year ?",no_emotion
Interesting ...,no_emotion
Gotta get out on [NAME],no_emotion
"No , I have to do this ; it's important !",no_emotion
Thats too funny,happiness
No problem . May I see your identification ?,no_emotion
"[NAME] might be all those things, but he pissed me off canceling his appearances at Coachella and Gov’s Ball. Very unwavy of him ",sadness
"Sure , I love looking at photos .",happiness
