text,emotion
"No , some of them are my friend's . Do you want her passport , too ?",no_emotion
"Brandy , I am supposed to participate in an interview tomorrow .",no_emotion
I’m not listening to a fucking plant.,anger
Do you have any other plans this weekend ?,no_emotion
Thanks a lot .,happiness
It's a ruby . It is from South Africa . Would you like to try it on ?,no_emotion
i think u mean symfuhny lol,happiness
I would pay good coin to read that love story.,happiness
You did ? I thought you must feel right at home here as we get as many fast food restaurants as you do in America .,surprise
"My wife is not allowed to flick my ears for any reason, and apparently I'm not allowed to stick my finger into her bellybutton lmao.",happiness
Typical. Ugh,no_emotion
When will the branch office open ?,no_emotion
"When you brush your teeth , what do you use ?",no_emotion
"Oh , I see . And can your family utilize 5 the health insurance , too ?",no_emotion
It's a clear spirit we drink any time of the day . You will love it !,happiness
a couple of times a week . i've got a regular dancing partner . he is really some dancer,no_emotion
"Hand-baggage is not to be weighed , sir ... I'm sorry , sir , you're 25 kilos overweight . I'm afraid there'll be an excess luggage charge , sir .",no_emotion
How long have you been working there ?,happiness
It rumored that Jean is fooling around with another woman's husband .,no_emotion
"That could be a quick way to see the next great Orlando big man end up in LA, haha. ",happiness
"Oh dear, you are entertaining. Please, talk more to me. ",happiness
Why don't you park in the parking structure for students ?,no_emotion
Is it out ?,no_emotion
Reminds me of this short.,no_emotion
What do you think of smoking ?,no_emotion
"Mum , can I finish my homework later ?",no_emotion
Not even a single drop ?,no_emotion
Then what ?,no_emotion
I don't really need five .,no_emotion
learn to say no more. After a few times you have something you like destroyed it gets easier.,happiness
"Okay , I'll be right back ... Congratulations ! The manager approved the final price $ 15,000 .",sadness
"Nowadays , ships and boats are no longer so important in transportation as they used to be .",no_emotion
Sure . I think filet steak will be a good choice . It's the best local food .,no_emotion
"Sounds like you know the answer, and at first she will resent you. But hopefully over time will realize what your doing. ",happiness
I'm afraid not . I've promised my girlfriend . We'll travel southwards to find a job that offers higher pay .,no_emotion
"If your weed is decent you don't need tobacco to help it burn, and tobacco is addictive",no_emotion
What was the weather like in New York ?,no_emotion
"Yes.There are trains at seven fifty-nine , nine eighteen , ten thirty-two and eleven fifty-five .",no_emotion
DO you have any plan for your future ?,no_emotion
Not quite . I also like romance and comedy movies very much .,no_emotion
It sounds a good idea . Let ’ s go .,happiness
My internet is having problems connecting .,no_emotion
"Alright.Well , I'll stay here and have another coffee . Nice running into you .",no_emotion
"Okay , let's go !",happiness
You're welcome .,happiness
Why do you want to be a teacher ?,no_emotion
I want a chemise .,no_emotion
It took me forever to realize it was not in fact [NAME]....,no_emotion
">Dude, nobody reads. That is *really* not true. ",sadness
"Wrong . lt's not a place name , but a passionate act .",no_emotion
But you didn't eat anything today .,no_emotion
"That’s a bold move, [NAME]. Let’s see if it pays off. ",no_emotion
Many thanks .,no_emotion
I submitted my resignation on October 6th.,no_emotion
"Wow, I know he is the voice of [NAME], but I did not know he basically IS [NAME]",no_emotion
You were right ! He didn ’ t make the shot !,no_emotion
"Well , I bought this skirt here yesterday afternoon . But I got the wrong size . It ’ s too small for my daughter . I wonder if I could refund it .",no_emotion
I know it is . I don't know how it happened .,no_emotion
We open at lo,no_emotion
Our seafood is fresh . I recommend shrimp with garlic .,no_emotion
Are there many idioms in English ?,no_emotion
"Yea I spotted it a bit later and decided to just leave it,",no_emotion
Never noticed how unsettling palpatine looked,no_emotion
"Certainly , sir . How much do you draw ?",no_emotion
"Good , we'll take 500 suits .",no_emotion
"Maybe it depends on the state. In California, that means you’re a moderate [NAME].",no_emotion
How respectable !,no_emotion
"How about ""Your rich, you should use some of your wealth to seek professional help. I wish you the best of luck.""",happiness
Not where I expected that to go...but uh...good luck out there!,no_emotion
Goodbye my tank commander!,no_emotion
Sex is not a basic need for survival,no_emotion
"The sun in his eyes makes him look pissed, like he and the ducks had some personal history.",anger
"so , what did you get them ?",no_emotion
"Today , I am busy all day long .",sadness
Wishing the best for your pupper.,happiness
OK . Where ?,happiness
> super model strange Oh man,surprise
Do you like my carpet ? Be honest ! Tell me what you really think .,surprise
"Mom , I'm starving .",no_emotion
We all are looking for different things in an instructor . I hope I've helped you .,no_emotion
That's terrific . Thank you .,happiness
No. I'm just against forcing your beliefs on people who aren't old enough to distinguish reality from fiction.,sadness
"Morning , Madam . This is the window for Foreign Exchange Savings . How can I help you ?",no_emotion
"Yes, and you must be a loonbag. ",happiness
"Today is Tuesday , 25th September , 2001 .",no_emotion
Steve . Is that you ?,surprise
"Maybe, just this time, it's for the better.",happiness
True! He probably is just lonely. Thank you for the kind words :),happiness
"Yes , it is . But I'm afraid we haven't met before .",no_emotion
"Well , it certainly makes everything easier , both at this end and at your end .",no_emotion
"No , thanks .",no_emotion
The applause came from [NAME] and his group.,happiness
"Yes , please . I'm picking out some presents for my children and wife .",no_emotion
now I kinda wish [NAME] wasn't an imaginary cartoon character because this would actually be fun.,happiness
"If the money was sent by cable , it would have taken about one or two days . But if it was sent by airmail , it would take at least one week .",no_emotion
"Although we have many things in common , we'are not soul mates .",no_emotion
This is so powerful.,happiness
"Thank you , Mr.Burton.Can you please hold for a moment ? I'll check to see if she is available .",no_emotion
"Tom , it's time for you to go to bed .",no_emotion
Good . We will make the offer tomorrow afternoon . Is that all right ?,no_emotion
What's for dinner tonight ?,no_emotion
"I don't think it was the problem with your hands , you did several excellent spares . You have no problem with your hands .",no_emotion
Yes . I am going to have a summer vacation . Would you recommend some scenic spots to see ?,no_emotion
"Usually it's 60 dollars for a manicure , and 80 dollars for a pedicure . But with this special discount , the total for both is only one hundred and 20 dollars , and you can get them painted .",no_emotion
KIA is mad at a guy streaming for a charity that they don't like?,no_emotion
I don't know . I want my clothes to be clean .,no_emotion
"Absolutely not ! Native speakers make a lot of grammar mistakes , especially if they come from a home where nonstandard English is spoken .",no_emotion
"Ahh , I was not available last Sunday . I was too busy almost as much as you .",no_emotion
"After the internal discussion , we have all agreed that you are the most suitable person for this position among all the candidates . So , today let ’ s talk about your expected salary and social benefits . What is your expected salary ?",no_emotion
"He is such a cutie, I had no idea he was polish ",happiness
"Why do people like all this fancy , expensive underwear ?",no_emotion
"OK , here you are . You look really attractive in that gown .",happiness
"This is just what I've been looking for . Sign me up right away , please .",happiness
"Maybe, but I don’t think he’s capable of make a studio by himself lol",happiness
It will be hard to say good-bye . This office has become like a second home to me .,no_emotion
How come ?,no_emotion
Thank you for understanding . I promise I ’ ll make it up to you .,happiness
Thank you!! Every time I see someone say “with one exception” I’m like nooo! It’s a song too!!,happiness
"Yes , what can I do for you ?",no_emotion
What about affirmative action ? Hasn't legislation changed a lot of the make hierarchy ?,no_emotion
We have our daily appetizers listed on the board over there on the wall .,no_emotion
Yes . How much do you charge for it ?,no_emotion
And what size would you like ?,no_emotion
[NAME]: [NAME] is your nephew [NAME]: is this about your dad and bro?,no_emotion
"u/dances-with-corgis Says they'll never forget their username. Literally forgot their username. Sorry, but: 😂😂😂😂, that's some [NAME] level tiny mess up.",happiness
It's huge !,surprise
I see . Thank you .,happiness
"Heard Sale players yelling at the refs and nothing has come of it, seems odd to suddenly have an issue with it",anger
"I was planning to attend gradate school , but then I was offered a good job doing marketing , so I changed my mind .",happiness
How about this weekend ?,no_emotion
What else is there at the EDD offices that can help me with my job search ?,no_emotion
I would love a margarita right now ! That is what I am going to order .,happiness
"You don ’ t need plastic surgery to do that . You are fine the way you are and you have guys drooling all over you ! Plus , plastic surgery hurts !",no_emotion
She’s clearly hanging at least part way into the space. She’s so dumb,anger
I can sign a contract up to a year . I don ’ t know where I ’ ll be after that .,no_emotion
"True but the majority of plastic used is for the shelved grocery items. Pasta, rice, coffee are in every household and are all packaged in plastic ",happiness
Oh my gosh! That light house!! Its terrifying!!,fear
How long will it take to learn English ? Will I be able to take other courses next semester or will English take up all of my time ?,no_emotion
"Yes , over there to your left .",no_emotion
"Me , too ! The chips here are so light and crispy .",no_emotion
Its that classic rare games bring everyone together,no_emotion
Great to hear that. Scary few hours for y’all.,happiness
Is your brother older or younger than you ?,no_emotion
"Yeah, the only issue with the scene is how long the dance scene goes. ",anger
I actually liked them. I love the idea of Conqueror being a rabid and maniac dog.,happiness
Chills. I can’t wait. I’m sure [NAME] will get over this not being happy because they have bigger fish to fry.,sadness
Do you think the plane will leave without me ?,no_emotion
"Congratulations , I hope everything works out .",happiness
>Good morning.,no_emotion
"FYI she’s probably cheating on someone, so didn’t want to post pics. ",no_emotion
What's your best price for that item ?,no_emotion
"May I come in , Mr Sun ?",no_emotion
and fruits !,no_emotion
I recognize this YouTube channel... They make beautiful furniture. This has to be at customer request. I have no idea how to explain it otherwise.,happiness
Booze !,no_emotion
They are made a town nearby . The flower vases are made of porcelain and covered with tiny bamboo sticks .,no_emotion
Ok who is yelling OHHHH every time [NAME] throws a punch,no_emotion
"I mean, you're the one rationalizing for what essentially amounts to a presidential dictatorship.",anger
Thirty percent ?,no_emotion
I said I'm curious to see how many women would do it.,no_emotion
Don't be in such a hurry . I'm confident that you'll be completely recovered in 4 to 6 weeks .,no_emotion
A ETV ? Are you serious ? ETV ?,surprise
"Steven , I ...",fear
Waiting must be really boring,sadness
I peg the difference,no_emotion
I feel horrible for the government workers caught in the middle of this. I hope it ends soon.,fear
"ln this size , we sell it for 53.95 .",no_emotion
"Can Join you , Katherine ? I do want to have a try .",no_emotion
Good.If you happen to see Jim and Bob on the way see if they would like a game of singsong .,happiness
"And maybe you can divert her physical touch to something like holding hands, or putting your arm around her while sitting on the couch. ",no_emotion
Hmmmmm never thought about it like that,no_emotion
"No , we are just too different . This relationship isn't going anywhere .",no_emotion
Oh ! I hit it .,happiness
"Maybe not , but I advice you to say it was your fault .",no_emotion
"I need more videos of this cat, love its face xD",happiness
What can I do for you ?,no_emotion
Now you have to make up all these downvotes with some low-hanging-fruit criticism comment of [NAME] or [NAME]. Good luck and cheers!,happiness
I recommend this. I read the WN and it fucked up my English for months. English is my second language...,happiness
Lady looks a bit psychopathic,no_emotion
Let me write it down on this slip of paper for you . You can show it to the taxi-driver .,no_emotion
But what is with that shirt?,no_emotion
Being compared to [NAME] is a compliment because he’s funnier than I’ll ever be soooo,happiness
Did you buy a new saddle as well. Also need to go to settings and set as default or make it active.,happiness
"[NAME] gets a lot of unfair criticism. [NAME], too",sadness
Wow ! What ’ s the hold up ?,surprise
It is 45 yuan on the meter .,no_emotion
I really like this ring so I’m glad to hear that.,happiness
Hug ! And this sweater from my aunt ? Isn ’ t it hideous ?,no_emotion
It's a good way to save money .,no_emotion
"Hi Jane , you look great .",no_emotion
Hawaii ? My dream honeymoon destination ?,surprise
Don’t tweets have to be formatted a certain way? Only thing I can think of,no_emotion
You just going into the posse menu and buy the persistent posse. It costs $200. Good luck ❤️,happiness
"Nothing different from a secretary's common responsibilities . However , you know , our company is an international trade-oriented company , can you handle English papers and write English correspondence ?",no_emotion
I’m chuckling at you referring to it as a little ho.,happiness
"What can I do for you , sir ?",no_emotion
"I think I can agree with you here, I kinda forgot about the military.",happiness
My neighbor hit my brother on the head . He ’ s bleeding .,no_emotion
My mom signed me up when I was 15. Wow that was a fun weekend. /s,happiness
Exactly . Here is the Nine-dragon Screen .,no_emotion
"No friends anymore, but had a guy get jealous at another guy flirting with me.",happiness
Old people sure do love their cable news history,happiness
It’s 8 rounds on all different topics organized by check it,no_emotion
How's it ?,no_emotion
Why not ?,no_emotion
"Hello , Becky . Well , you see , I have this thing here , called a Fixed Deposit Certificate , and I've just noticed the date on it .",no_emotion
"Hell yea brother, Charlotsvile car attacker did nothing wrong Lets see how quick they scream hate speech",anger
Are things still going badly with your houseguest ?,no_emotion
Is this your first year in college ?,no_emotion
That's all right.Thank you .,happiness
"One orange juice , scrambled eggs with bacon , toast and coffee .",no_emotion
Thanks .,no_emotion
I actually like my vagina... I suspect it’s actually my husband that is the problem,anger
I forgot not everyone has accused me of,no_emotion
"David , what do you want to do after graduation ?",no_emotion
"Yes , that's a good idea .",no_emotion
No – That ’ s all right . How about the 30th at 4:00 p . m . ? – Is an hour enough ?,no_emotion
"Similarly, the Library of Congress is open and is absolutely beautiful. It's free and I highly recommend it even when the Smithsonian's aren't closed.",happiness
I'll check the costs and call you back .,no_emotion
I hope that's real lol,happiness
Can I make a reservation for flight FW58 to San Marino ?,no_emotion
Why don't you wash clothes at home ?,no_emotion
"Have you been eating properly ? Eating the right kind of food is important for your health , you know .",no_emotion
Well control is really using common sense when you plan your eating habits .,no_emotion
Okay . I'm going to stay up a while . I've got to go over the household budget . We've sightly overspent this month .,no_emotion
[NAME] was our only playmaker the past few years.,happiness
"This is what my boss is expecting , Sandy . He wants a detailed list of expenses and equipment costs .",no_emotion
Not too serious . But he gave me a strict diet to help bring it down .,no_emotion
Your post : 39 minutes ago THE POST THATS LITERALLY UNDER YOU WITH THE SAME MEME : 40 MINUTES AGO,no_emotion
"But you'll promise not to be late for dinner tonight , won't you ?",no_emotion
That's great .,happiness
You just found out your dog has a girl and a kid. How does it feel Grandpa?,no_emotion
I ’ ll take it . I also need to improve the lighting in my living room . Do you have any suggestions ?,no_emotion
What the hell . That doesn't make sense . What are you going to do ?,no_emotion
The machines will turn on once you put the quarters into the slot .,no_emotion
"Yes , I did .",no_emotion
I can’t even count how many times I heard “you always have to be right”,no_emotion
:o thats pretty good. Not what envision my boy [NAME] but I like this alot.,happiness
Try a group called Our Companions website: people who care a great deal.,happiness
What would you like to be in the future ?,no_emotion
Thanks! There are so many resources available. Thank you for telling me about one that actually helped you,happiness
Apple can still go kindly fuck itself tho,anger
Will there be any extra charge ?,no_emotion
you give him way too much credit with this one,happiness
"It comes with an ice maker , water dispenser , and there is a lot of room inside .",no_emotion
"Todd , good to hear from you !",happiness
I study the administration.Yes.But I'm more attracted to writing articles . I want to use my knowledge of business to write financial news .,no_emotion
Can you tell me how many goods you intend to order ?,no_emotion
I'd be glad to .,happiness
"Oh , yes . It is a fantastic city . And I like German food as well .",happiness
I would like it transferred to my checking account .,no_emotion
My sister.She is going to her in-law's house this year .,no_emotion
Do you really think that global warming Wil destroy Earth some day ?,no_emotion
Why do you think you ’ re the right candidate for this position ?,no_emotion
This is Joey from Mary trading company . I learned that you are the leading export of cloth by Hummed company .,no_emotion
Just look at the picture,no_emotion
"Yes , but it's downtown . I would like to take look at this one .",no_emotion
"You would forget the price of such things and not care, too.",no_emotion
"A little , I wish I could do that .",no_emotion
Can you speak any other languages ?,no_emotion
"So , where do I go to exercise ?",no_emotion
See you .,happiness
"Don't feel that way . I know you are very smart.Note - taking is a special skill . All students need to learn it.Some people are very smart , but they just haven't learned how to take notes yet . I'm lucky because I had a good English teacher in high school.She taught me how to take good notes . It's not hard .",no_emotion
"I ’ m glad to hear that . As I ’ Ve just said , I hope to conclude some substantial business with you .",no_emotion
Only [NAME] could claim that shutting down the thing he is in charge of is a success.,no_emotion
"Yes , the nearest one is at the third cross of this road .",no_emotion
As long as you do the cooking by the book 😏,happiness
"Yes , but at least this way no one gets hurt.It ' s better to have a fire in your house when you're not home . Don't you think ?",no_emotion
"Yes , I know my hair is quite thin.It runs in my family . Everybody has very thin hair .",no_emotion
"So, the kicker... her brother played on Xbox so that's the console she had claimed to play on!",no_emotion
"Oh god, never thought of the implications of [NAME] not selling BB-8 as mirroring her parents giving her up. That tugs the heartstrings a little bit.",sadness
What sales do they have today ?,no_emotion
why not? standing to me isn’t as everything i need is on the floor lol,happiness
"Don't forget [NAME] being nerfed because she was unfun to play against in QM, then being reworked, then being nerfed again for the same reason.",no_emotion
"Well you wrote out this big comment, and it reads well but when you actually think about what you’ve said, IMO it really means nothing.",sadness
I need a packet of cigarettes please .,no_emotion
"Well , I think you should pay upon arrival .",no_emotion
Gotta cheat on taxes somehow LOL,happiness
Why do you think you are qualified for this position ?,no_emotion
Matthew ? Hi !,happiness
"You sound like you have a warped view of what makes someone strong and an overblown, distorted sense of your own masculinity. ",no_emotion
Just carry a 20mm.,no_emotion
I don't know much about computers . But I know I want a desktop computer with a lot of memory . And I need a printer .,no_emotion
I ’ m pretty tired . I haven ’ t been sleeping well .,sadness
"ah, i see. yeah it’s true that the title does seem pretty flippant, though maybe the article itself is better?",happiness
"Well , I missed several buses .",no_emotion
I just found my new flair. Thanks [NAME].,happiness
Worst dad ever!,anger
Get rid. This is a toxic relationship that is making you unhappy. You are making all efforts for nothing in return.,happiness
Thank you ... please sign on the line .,happiness
and can you dance tango ?,no_emotion
What do you think of the new television channel ? Aren't the programs awful ?,disgust
A Mass Effect tarot deck would be awesome! That was exactly what I thought when I saw this.,happiness
"Ooooof, that’s annoying. I’m sorry.",sadness
Medium .,no_emotion
"I'm doing well , and you ?",no_emotion
I ’ m from Channel 5 News .,no_emotion
It sounds good . I will bring the papers I'm working on .,no_emotion
Sure .,no_emotion
The guy that started everything vs the guy who will end everything.,no_emotion
"I ... I ... I miss my parents , also they miss me .",no_emotion
Yeah . I'm really looking forward to it .,no_emotion
"Both are superb in their skills.Anyhow , Fred is one up on Bill from my point of view .",no_emotion
What is your most preferred training method ?,no_emotion
"Teachers are just directors who give scope to the students ' initiative and creativeness , instead of taking their rights away from speaking .",no_emotion
It's like...I knew where this was going and I still laughed.,happiness
not funny enough for that,no_emotion
How did I do ?,no_emotion
"Yes , I did this in the morning . And my doctor wanted me to have a rest these two days .",no_emotion
That ’ s why it ’ s become a very popular holiday destination these years . Someone told me the service there is very good too . Are you planning to spend the holiday there ?,no_emotion
"hope everything ended up alright, op! ",happiness
I mean I just screenshotted this out of my news feed.,no_emotion
Do I need to pay any extra change for my suitcases ?,no_emotion
"Yes , I will . Thank you , Mr . White . Goodbye !",no_emotion
is it a jailable offence,no_emotion
"Yes , I do show your reservation . How could you like to pay for the room ?",no_emotion
Single . How much ?,no_emotion
"I see . All right , well I think everything else I can figure out on my own . The deductions for health insurance and my 401 ( K ) are pretty self-explanatory . Thanks for your help , Susan .",happiness
"> We're angry, but we don't want to be labelled as violent nutters.",anger
So can [NAME],no_emotion
No . But I am going to apply for some vocational schools . I like fashion design and want to study it .,happiness
Certainly.Go ahead .,happiness
Want to meet for lunch this Saturday ?,no_emotion
We need to get it fixed soon .,no_emotion
She's at home .,no_emotion
Let's try it !,no_emotion
It depends on who the film is about . Which movie did you have in mind ?,no_emotion
Where can I take it ?,no_emotion
"It's not a recessed center, there's an edge cut out around the outside. It's from the melting pot, best fondue restaurant! ",happiness
I don't think much of the film .,no_emotion
"If it results in killing [NAME], [NAME] is willing to be merciful and hold his wrath back against the kids.",no_emotion
"Yes , I'm really weak in maps , I did poorly in high school .",no_emotion
I got confused for a second and thought why would you pay for your ex's trip,no_emotion
oh the new Zealand thing thank you,happiness
Hello . What can we do for you ?,no_emotion
"OK . Good night , then . Have a good sleep .",happiness
"Please correct me if I'm wrong, but I thought that the name changes had more to do with legal issues then geographical ones.",no_emotion
I don ’ t mind that . But she disagrees with me about everything .,no_emotion
[NAME] is completely delusional. She’s in extreme denial and only hears and sees what she wants to.,no_emotion
"All right . Where do you live , sir ?",no_emotion
Thank you . Now how much do I owe you ?,happiness
Your bags will be here shortly .,no_emotion
Strangely enough 70% of women in the work place are queen bees,no_emotion
How are you getting along with your studies ?,no_emotion
"My plans aren't until later , so I'll clean it before I go .",no_emotion
"I'll use my VISA , if that's okay .",no_emotion
Yes. What do you use? Geocities?,no_emotion
Yeah . You look so unhappy recently . What ’ s the matter .,no_emotion
I can't stand the loud noise in the city .,no_emotion
"I think 2,000 would be fine .",no_emotion
